CIIU ID S,CIIU ID D,CIIU ID CL,CIIU label CL
12,68,6820,Actividades inmobiliarias realizadas a cambio de una retribución o por contrata 
13,69,6910,Actividades jurídicas
13,69,6920,"Actividades de contabilidad, teneduría de libros, auditoría financiera y asesoría tributaria"
13,70,7010,Actividades de administración empresarial
13,70,7020,Actividades de consultaría de gestión
13,71,7110,Actividades de arquitectura e ingeniería y otras actividades conexas de consultoría técnica
13,71,7120,Ensayos y análisis técnicos
13,72,7210,Investigaciones y desarrollo experimental en el campo de las ciencias naturales y la ingeniería 
13,72,7220,Investigaciones y desarrollo experimental en el campo de las ciencias sociales y las humanidades
13,73,7310,Publicidad
13,73,7320,Estudios de mercado y realización de encuestas de opinión pública
13,74,7410,Actividades especializadas de diseño 
13,74,7420,Actividades de fotografía
13,74,7490,"Otras actividades profesionales, científicas y técnicas n.c.p."
13,75,7500,Actividades veterinarias
14,77,7710,Alquiler y arrendamiento de vehículos automotores
14,77,7721,Alquiler y arrendamiento de equipo recreativo y deportivo
14,77,7722,Alquiler de videos y discos 
14,77,7729,Alquiler y arrendamiento de otros efectos personales y enseres domésticos n.c.p.
14,77,7730,"Alquiler y arrendamiento de otros tipos de maquinaria, equipo y bienes tangibles n.c.p."
14,77,7740,"Arrendamiento de propiedad intelectual y productos similares, excepto obras protegidas por derechos de autor"
14,78,7810,Actividades de agencias de empleo
14,78,7820,Actividades de agencias de empleo temporal
14,78,7830,Otras actividades de suministro de recurso humano
14,79,7911,Actividades de las agencias de viaje
14,79,7912,Actividades de operadores turísticos
14,79,7990,Otros servicios de reserva y actividades relacionadas
14,80,8010,Actividades de seguridad privada
14,80,8020,Actividades de servicios de sistemas de seguridad
14,80,8030,Actividades de detectives e investigadores privados
14,81,8110,Actividades combinadas de apoyo a instalaciones
14,81,8121,Limpieza general interior de edificios
14,81,8129,Otras actividades de limpieza de edificios e instalaciones industriales
14,81,8130,Actividades de paisajismo y servicios de mantenimiento conexos
14,82,8211,Actividades combinadas de servicios administrativos de oficina
14,82,8219,"Fotocopiado, preparación de documentos y otras actividades especializadas de apoyo a oficina"
14,82,8220,Actividades de centros de llamadas (Call center)
14,82,8230,Organización de convenciones y eventos comerciales
14,82,8291,Actividades de agencias de cobranza y oficinas de calificación crediticia
14,82,8292,Actividades de envase y empaque
14,82,8299,Otras actividades de servicio de apoyo a las empresas n.c.p.
15,84,8411,Actividades legislativas de la administración pública
15,84,8412,Actividades ejecutivas de la administración pública
15,84,8413,"Regulación de las actividades de organismos que prestan servicios de salud, educativos, culturales y otros servicios sociales, excepto servicios de seguridad social "
15,84,8414,Actividades reguladoras y facilitadoras de la actividad económica
15,84,8415,Actividades de los otros órganos de control
15,84,8421,Relaciones exteriores 
15,84,8422,Actividades de defensa
15,84,8423,Orden público y actividades de seguridad
15,84,8424,Administración de justicia
15,84,8430,Actividades de planes de seguridad social de afiliación obligatoria
16,85,8511,Educación de la primera infancia
16,85,8512,Educación preescolar
16,85,8513,Educación básica primaria
16,85,8521,Educación básica secundaria 
16,85,8522,Educación media académica
16,85,8523,Educación media técnica y de formación laboral
16,85,8530,Establecimientos que combinan diferentes niveles de educación 
16,85,8541,Educación técnica profesional
16,85,8542,Educación tecnológica
16,85,8543,Educación de instituciones universitarias o de escuelas tecnológicas
16,85,8544,Educación de universidades
16,85,8551,Formación académica no formal 
16,85,8552,Enseñanza deportiva y recreativa
16,85,8553,Enseñanza cultural
16,85,8559,Otros tipos de educación n.c.p.
16,85,8560,Actividades de apoyo a la educación
17,86,8610,"Actividades de hospitales y clínicas, con internación"
17,86,8621,"Actividades de la práctica médica, sin internación"
17,86,8622,Actividades de la práctica odontológica
17,86,8691,Actividades de apoyo diagnóstico
17,86,8692,Actividades de apoyo terapéutico
17,86,8699,Otras actividades de atención de la salud humana
17,87,8710,Actividades de atención residencial medicalizada de tipo general
17,87,8720,"Actividades de atención residencial, para el cuidado de pacientes con retardo mental, enfermedad mental y consumo de sustancias psicoactivas"
17,87,8730,Actividades de atención en instituciones para el cuidado de personas mayores y/o discapacitadas
17,87,8790,Otras actividades de atención en instituciones con alojamiento
17,88,8810,Actividades de asistencia social sin alojamiento para personas mayores y discapacitadas
17,88,8890,Otras actividades de asistencia social sin alojamiento
18,90,9001,Creación literaria
18,90,9002,Creación musical
18,90,9003,Creación teatral
18,90,9004,Creación audiovisual
18,90,9005,Artes plásticas y visuales
18,90,9006,Actividades teatrales
18,90,9007,Actividades de espectáculos musicales en vivo
18,90,9008,Otras actividades de espectáculos en vivo
18,91,9101,Actividades de bibliotecas y archivos
18,91,9102,"Actividades y funcionamiento de museos, conservación de edificios y sitios históricos"
18,91,9103,"Actividades de jardines botánicos, zoológicos y reservas naturales"
18,92,9200,Actividades de juegos de azar y apuestas
18,93,9311,Gestión de instalaciones deportivas
18,93,9312,Actividades de clubes deportivos
18,93,9319,Otras actividades deportivas
18,93,9321,Actividades de parques de atracciones y parques temáticos
18,93,9329,Otras actividades recreativas y de esparcimiento n.c.p.
19,94,9411,Actividades de asociaciones empresariales y de empleadores
19,94,9412,Actividades de asociaciones profesionales
19,94,9420,Actividades de sindicatos de empleados
19,94,9491,Actividades de asociaciones religiosas
19,94,9492,Actividades de asociaciones políticas
19,94,9499,Actividades de otras asociaciones n.c.p.
19,95,9511,Mantenimiento y reparación de computadores y de equipo periférico
19,95,9511,Mantenimiento y reparación de computadores y de equipo periférico
19,95,9512,Mantenimiento y reparación de equipos de comunicación
19,95,9512,Mantenimiento y reparación de equipos de comunicación
19,95,9521,Mantenimiento y reparación de aparatos electrónicos de consumo
19,95,9521,Mantenimiento y reparación de aparatos electrónicos de consumo
19,95,9522,Mantenimiento y reparación de aparatos y equipos domésticos y de jardinería 
19,95,9522,Mantenimiento y reparación de aparatos y equipos domésticos y de jardinería 
19,95,9523,Reparación de calzado y artículos de cuero
19,95,9523,Reparación de calzado y artículos de cuero
19,95,9524,Reparación de muebles y accesorios para el hogar
19,95,9524,Reparación de muebles y accesorios para el hogar
19,95,9529,Mantenimiento y reparación de otros efectos personales y enseres domésticos
19,95,9529,Mantenimiento y reparación de otros efectos personales y enseres domésticos
19,96,9601,"Lavado y limpieza, incluso la limpieza en seco, de productos textiles y de piel"
19,96,9602,Peluquería y otros tratamientos de belleza
19,96,9603,Pompas fúnebres y actividades relacionadas
19,96,9609,Otras actividades de servicios personales n.c.p.
20,97,9700,Actividades de los hogares individuales como empleadores de personal doméstico
20,98,9810,Actividades no diferenciadas de los hogares individuales como productores de bienes para uso propio
20,98,9820,Actividades no diferenciadas de los hogares individuales como productores de servicios para uso propio
21,99,9900,Actividades de organizaciones y entidades extraterritoriales
