CNAE ID CNG,CNAE label CNG,annual_avg_emplvl,CLAE 3,Descripción CLAE 3,annual_avg_emplvl
649,Atividades de servicos financeiros nao especificadas anteriormente,0.05,649,SERVICIOS FINANCIEROS EXCEPTO LOS DE LA BANCA CENTRAL Y LAS ENTIDADES FINANCIERAS,0.37
651,Seguros de vida e nao-vida,0.09,651,SERVICIOS DE SEGUROS,0.37
652,Seguros-saude,0.01,651,SERVICIOS DE SEGUROS,0.37
653,Resseguros,0.0,652,REASEGUROS,0.0
654,Previdencia complementar,0.03,653,ADMINISTRACIÓN DE FONDOS DE PENSIONES,0.0
655,Planos de saude,0.16,653,ADMINISTRACIÓN DE FONDOS DE PENSIONES,0.0
661,Atividades auxiliares dos servicos financeiros,0.08,661,"SERVICIOS AUXILIARES A LA ACTIVIDAD FINANCIERA, EXCEPTO A LOS SERVICIOS DE SEGUROS",0.04
662,"Atividades auxiliares dos seguros, da previdencia complementar e dos planos de saude",0.1,662,SERVICIOS AUXILIARES A LOS SERVICIOS DE SEGUROS,0.16
663,Atividades de administracao de fundos por contrato ou comissao,0.01,663,SERVICIOS DE GESTIÓN DE FONDOS A CAMBIO DE UNA RETRIBUCIÓN O POR CONTRATA,0.0
681,Atividades imobiliarias de imoveis proprios,0.09,681,"SERVICIOS INMOBILIARIOS REALIZADOS POR CUENTA PROPIA, CON BIENES PROPIOS O ARRENDADOS",0.84
682,Atividades imobiliarias por contrato ou comissao,0.18,682,SERVICIOS INMOBILIARIOS REALIZADOS A CAMBIO DE UNA RETRIBUCIÓN O POR CONTRATA,0.28
691,Atividades juridicas,0.31,691,SERVICIOS JURÍDICOS,0.34
692,"Atividades de contabilidade, consultoria e auditoria contabil e tributaria",0.52,692,"SERVICIOS DE CONTABILIDAD, AUDITORÍA Y ASESORÍA FISCAL",0.46
702,Atividades de consultoria em gestao empresarial,0.21,702,"SERVICIOS DE ASESORAMIENTO, DIRECCIÓN Y GESTIÓN EMPRESARIAL",0.82
711,Servicos de arquitetura e engenharia e atividades tecnicas relacionadas,0.6,711,SERVICIOS DE ARQUITECTURA E INGENIERÍA Y SERVICIOS TÉCNICOS NCP,0.84
712,Testes e analises tecnicas,0.05,712,ENSAYOS Y ANÁLISIS TÉCNICOS,0.02
721,Pesquisa e desenvolvimento experimental em ciencias fisicas e naturais,0.08,721,INVESTIGACIÓN Y DESARROLLO EXPERIMENTAL EN EL CAMPO DE LA INGENIERÍA Y DE LAS CIENCIAS EXACTAS Y NATURALES,0.02
722,Pesquisa e desenvolvimento experimental em ciencias sociais e humanas,0.01,722,INVESTIGACIÓN Y DESARROLLO EXPERIMENTAL EN EL CAMPO DE LAS CIENCIAS SOCIALES Y LAS HUMANIDADES,0.0
731,Publicidade,0.17,731,SERVICIOS DE PUBLICIDAD,0.14
732,Pesquisas de mercado e de opiniao publica,0.02,732,"ESTUDIO DE MERCADO, REALIZACIÓN DE ENCUESTAS DE OPINIÓN PÚBLICA",0.0
741,Design e decoracao de interiores,0.01,741,SERVICIOS DE DISEÑO ESPECIALIZADO,0.0
742,Atividades fotograficas e similares,0.04,742,SERVICIOS DE FOTOGRAFÍA,0.02
749,"Atividades profissionais, cientificas e tecnicas nao especificadas anteriormente",0.16,749,"ACTIVIDADES PROFESIONALES, CIENTÍFICAS Y TÉCNICAS NCP",0.03
750,Atividades veterinarias,0.01,750,SERVICIOS VETERINARIOS,0.04
771,Locacao de meios de transporte sem condutor,0.11,771,ALQUILER DE VEHÍCULOS AUTOMOTORES Y EQUIPO DE TRANSPORTE SIN CONDUCTOR NI OPERARIOS,0.03
772,Aluguel de objetos pessoais e domesticos,0.06,772,ALQUILER DE EFECTOS PERSONALES Y ENSERES DOMÉSTICOS,0.01
773,Aluguel de maquinas e equipamentos sem operador,0.26,773,"ALQUILER DE MAQUINARIA Y EQUIPO NCP, SIN PERSONAL",0.1
774,Gestao de ativos intangiveis nao-financeiros,0.01,774,ARRENDAMIENTO Y GESTIÓN DE BIENES INTANGIBLES NO FINANCIEROS,0.0
781,Selecao e agenciamento de mao-de-obra,0.28,780,OBTENCIÓN Y DOTACIÓN DE PERSONAL,0.25
782,Locacao de mao-de-obra temporaria,0.68,780,OBTENCIÓN Y DOTACIÓN DE PERSONAL,0.25
783,Fornecimento e gestao de recursos humanos para terceiros,0.22,780,OBTENCIÓN Y DOTACIÓN DE PERSONAL,0.25
791,Agencias de viagens e operadores turisticos,0.15,791,SERVICIOS DE AGENCIAS DE VIAJE Y OTRAS ACTIVIDADES COMPLEMENTARIAS DE APOYO TURÍSTICO,0.21
799,Servicos de reservas e outros servicos de turismo nao especificados anteriormente,0.01,791,SERVICIOS DE AGENCIAS DE VIAJE Y OTRAS ACTIVIDADES COMPLEMENTARIAS DE APOYO TURÍSTICO,0.21
801,"Atividades de vigilancia, seguranca privada e transporte de valores",1.31,801,SERVICIOS DE SEGURIDAD E INVESTIGACIÓN,2.01
802,Atividades de monitoramento de sistemas de seguranca,0.1,801,SERVICIOS DE SEGURIDAD E INVESTIGACIÓN,2.01
803,Atividades de investigacao particular,0.0,801,SERVICIOS DE SEGURIDAD E INVESTIGACIÓN,2.01
811,Servicos combinados para apoio a edificios,1.41,811,SERVICIO COMBINADO DE APOYO A EDIFICIOS,0.0
812,Atividades de limpeza,1.6,812,SERVICIOS DE LIMPIEZA DE EDIFICIOS,1.19
813,Atividades paisagisticas,0.04,813,SERVICIOS DE JARDINERÍA Y MANTENIMIENTO DE ESPACIOS VERDES,0.03
821,Servicos de escritorio e apoio administrativo,0.56,821,SERVICIOS DE APOYO A LA ADMINISTRACIÓN DE OFICINAS Y EMPRESAS,0.05
822,Atividades de teleatendimento,0.91,822,SERVICIOS DE CALL CENTER,0.67
823,"Atividades de organizacao de eventos, exceto culturais e esportivos",0.08,823,"SERVICIOS DE ORGANIZACIÓN DE CONVENCIONES Y EXPOSICIONES COMERCIALES, EXCEPTO CULTURALES Y DEPORTIVOS",0.0
829,Outras atividades de servicos prestados principalmente as empresas,1.11,829,SERVICIOS EMPRESARIALES NCP,1.01
841,Administracao do estado e da politica economica e social,17.02,841,Servicios de la administración pública,
842,Servicos coletivos prestados pela administracao publica,2.08,842,Prestación pública de servicios a la comunidad en general,
843,Seguridade social obrigatoria,0.11,843,Servicios de la seguridad social obligatoria,
851,Educacao infantil e ensino fundamental,1.09,851,ENSEÑANZA INICIAL Y PRIMARIA,5.33
852,Ensino medio,0.3,852,ENSEÑANZA SECUNDARIA,1.35
853,Educacao superior,1.42,853,ENSEÑANZA SUPERIOR Y FORMACIÓN DE POSGRADO,0.77
854,Educacao profissional de nivel tecnico e tecnologico,0.16,854,SERVICIOS DE ENSEÑANZA NCP,0.44
855,Atividades de apoio a educacao,0.06,855,SERVICIOS DE APOYO A LA EDUCACIÓN,0.0
859,Outras atividades de ensino,0.7,855,SERVICIOS DE APOYO A LA EDUCACIÓN,0.0
861,Atividades de atendimento hospitalar,2.19,861,SERVICIOS DE HOSPITALES,0.91
862,Servicos moveis de atendimento a urgencias e de remocao de pacientes,0.02,862,SERVICIOS DE ATENCIÓN AMBULATORIA REALIZADOS POR MÉDICOS Y ODONTÓLOGOS,0.34
863,Atividades de atencao ambulatorial executadas por medicos e odontologos,0.55,863,"SERVICIOS DE PRÁCTICAS DE DIAGNÓSTICO Y TRATAMIENTO; SERVICIOS INTEGRADOS DE CONSULTA, DIAGNÓSTICO Y TRATAMIENTO",0.65
864,Atividades de servicos de complementacao diagnostica e terapeutica,0.41,864,SERVICIOS DE EMERGENCIAS Y TRASLADOS,0.17
865,"Atividades de profissionais da area de saude, exceto medicos e odontologos",0.14,869,SERVICIOS RELACIONADOS CON LA SALUD HUMANA NCP,1.33
866,Atividades de apoio a gestao de saude,0.09,869,SERVICIOS RELACIONADOS CON LA SALUD HUMANA NCP,1.33
869,Atividades de atencao a saude humana nao especificadas anteriormente,0.2,869,SERVICIOS RELACIONADOS CON LA SALUD HUMANA NCP,1.33
871,"Atividades de assistencia a idosos, deficientes fisicos, imunodeprimidos e convalescentes, e de infra-estrutura e apoio a pacientes prestadas em residencias coletivas e particulares",0.1,870,SERVICIOS SOCIALES CON ALOJAMIENTO,0.39
872,"Atividades de assistencia psicossocial e a saude a portadores de disturbios psiquicos, deficiencia mental e dependencia quimica",0.03,870,SERVICIOS SOCIALES CON ALOJAMIENTO,0.39
873,Atividades de assistencia social prestadas em residencias coletivas e particulares,0.08,870,SERVICIOS SOCIALES CON ALOJAMIENTO,0.39
880,Servicos de assistencia social sem alojamento,0.26,880,SERVICIOS SOCIALES SIN ALOJAMIENTO,0.03
900,"Atividades artisticas, criativas e de espetaculos",0.04,900,SERVICIOS ARTÍSTICOS Y DE ESPECTÁCULOS,0.05
910,Atividades ligadas ao patrimonio cultural e ambiental,0.01,910,"SERVICIOS DE BIBLIOTECAS, ARCHIVOS Y MUSEOS Y SERVICIOS CULTURALES NCP",0.02
920,Atividades de exploracao de jogos de azar e apostas,0.0,920,SERVICIOS RELACIONADOS CON JUEGOS DE AZAR Y APUESTAS,0.67
931,Atividades esportivas,0.34,931,SERVICIOS PARA LA PRÁCTICA DEPORTIVA,0.53
932,Atividades de recreacao e lazer,0.09,939,SERVICIOS DE ESPARCIMIENTO NCP,0.19
941,"Atividades de organizacoes associativas patronais, empresariais e profissionais",0.16,911,"Servicios de organizaciones empresariales, profesionales y de empleadores",
942,Atividades de organizacoes sindicais,0.26,912,Servicios de sindicatos,
943,Atividades de associacoes de defesa de direitos sociais,0.78,949,SERVICIOS DE ASOCIACIONES NCP,0.0
949,Atividades de organizacoes associativas nao especificadas anteriormente,0.62,949,SERVICIOS DE ASOCIACIONES NCP,0.0
951,Reparacao e manutencao de equipamentos de informatica e comunicacao,0.13,951,REPARACIÓN Y MANTENIMIENTO DE EQUIPOS INFORMÁTICOS Y EQUIPOS DE COMUNICACIÓN,0.01
952,Reparacao e manutencao de objetos e equipamentos pessoais e domesticos,0.12,952,REPARACIÓN DE EFECTOS PERSONALES Y ENSERES DOMÉSTICOS,0.05
960,Outras atividades de servicos pessoais,0.46,960,SERVICIOS PERSONALES NCP,1.35
970,Servicos domesticos,0.01,950,Servicios de hogares privados que contratan servicio doméstico,
990,Organismos internacionais e outras instituicoes extraterritoriais,0.01,990,Servicios de organizaciones y órganos extraterritoriales,
